
{
  "version": 1,
  "projectId": "presque-isle-gull-point",
  "name": "Presque Isle â€“ Gull Point Demo",
  "tiles": "tiles.mbtiles",
  "routes": ["gull-point-trail.geojson"],
  "audioPacks": [
    {"id":"voiceA","file":"voiceA.m4a","gainDb":-3},
    {"id":"musicA","file":"musicA.m4a","gainDb":0}
  ],
  "layers": [
    {"id":"voice","defaultMuted":false,"duckMusicDb":-6},
    {"id":"music","defaultMuted":false}
  ],
  "zones": [
    {
      "id":"trailhead",
      "shape":{"type":"circle","center":[-80.0856948,42.1714837],"radiusM":35},
      "enterActions":[
        {"type":"play","layer":"music","audioId":"musicA","fadeInMs":2000,"loop":true}
      ],
      "exitActions":[
        {"type":"fade","layer":"music","toDb":-60,"ms":1500}
      ],
      "priority":5
    }
  ],
  "snapToPath": true,
  "gps": {"normalHz":0.5,"nearZoneHz":2.0,"distanceTriggerM":15}
}
